{
    "$schema": "../../../environments/config/config.schema.json",
    "apiBaseURL": "https://localhost:7180/",
    "appInsightsKey": "211f0722-a9f3-4c1c-b45f-123206a0dfbe",
    "humanAPIClientId": "5726f93bd107d6ad899e272c48702f1767d60330",
    "logging": {
        "errorLogTo": [
            "console",
            "appInsights"
        ],
        "loggingLevel": "info"
    }
}
